{
  "schema_version": 1,
  "pack_version": "0.1.0-preview",
  "built_on": "2026-09-15T12:00:00Z",
  "git": {
    "commit": "0000000000000000000000000000000000000000",
    "branch": "main",
    "dirty": false
  },
  "toolchain": {
    "pandoc": "3.11",
    "typst": "0.15.1",
    "os": "darwin-arm64",
    "source_date_epoch": 1789430000,
    "source_date_epoch_from": "commit"
  },
  "artifacts": [
    {
      "path": "release/00-recommendations-and-practices.pdf",
      "sha256": "0000000000000000000000000000000000000000000000000000000000000000",
      "bytes": 1,
      "pages": 1,
      "source": "docs/00-recommendations-and-practices.md"
    }
  ]
}
